Topic_Num,Topic_Perc_Contrib,Keywords,Representative Text
0.0,0.9078999757766724,"control, infection, including, measures, effective, isolation, infected, spread, individuals, covid_19","['impact', 'early', 'social_distancing', 'covid_19', 'outbreak', 'largest', 'metropolitan_area', 'brazil']"
1.0,0.9197999835014343,"patients, cases, respiratory, infection, care, risk, hospital, clinical, coronavirus, patient","['clinical', 'predictors', 'mortality', 'middle_east_respiratory_syndrome', 'coronavirus', 'mers_cov', 'infection', 'cohort', 'study']"
2.0,0.9320999979972839,"health, disease, infectious, factors, diseases, public, transmission, viral, environmental, human","['population', 'response', 'risk', 'vector_borne', 'diseases', 'lessons_learned', 'socio', 'behavioural', 'research', 'large_scale', 'outbreaks']"
3.0,0.9332000017166138,"sars, transmission, model, epidemic, outbreak, data, time, china, days, dynamics","['relatedness', 'incidence_decay', 'exponential_adjustment', 'idea', 'model', 'farrs_law', 'sir', 'compartmental', 'difference', 'equation', 'models']"
4.0,0.9229999780654907,"virus, viruses, abstract, infections, host, chapter, airborne, epidemiology, travel, agents","['lymphocytic', 'choriomeningitis', 'virus', 'matrix', 'protein', 'ppxy_late', 'domain', 'drives', 'production', 'defective', 'interfering', 'particles']"
